{
  "id": "section-writing-2026-07",
  "as_of": "2026-07-30",
  "method": "A deterministic, balanced sample of official full-paper PDFs was converted to local text for document-level structural analysis. The repository retains only source IDs and aggregate counts, not paper prose.",
  "scope": "Forty papers from the audited 2021–2025 collection were sampled across reinforcement learning, embodied AI, world models, and vision-language-action models to calibrate Abstract, Introduction, Experiments, analysis, and table protocols.",
  "sample_source_ids": [
    "ganesh2025-sharper-global-convergence-analysis",
    "chen2023-imitation-learning-state-matching",
    "liu2023-learning-identify-critical-states",
    "kong2025-mastering-massive-multi-task",
    "huang2024-diffusion-models-optimizers-efficient",
    "choi2023-local-guided-global-paired",
    "zhai2023-stabilizing-visual-reinforcement-learning",
    "wang2024-more-benefits-being-distributional",
    "barakat2025-global-optimality-policy-gradient",
    "sharma2025-globally-optimal-policy-gradient",
    "dang2025-ecbench-can-multi-modal",
    "kondoh2025-embodied-navigation-auxiliary-task",
    "kim2025-test-time-adaptation-online",
    "cui2024-frontier-enhanced-topological-memory",
    "han2025-roomtour3d-geometry-aware-video",
    "wang2025-rethinking-embodied-gap-vision",
    "li2025-larm-large-auto-regressive",
    "qi2024-shapellm-universal-3d-object",
    "huang2025-enerverse-envisioning-embodied-future",
    "jiang2025-time-reversal-symmetry-efficient",
    "fu2025-knowledge-retention-continual-model",
    "feng2025-gaussian-based-world-model",
    "bar2025-navigation-world-models",
    "lee2025-temporal-distance-aware-transition",
    "hao2025-neural-motion-simulator-pushing",
    "venkatesh2024-understanding-physical-dynamics-counterfactual",
    "hong2024-model-based-reinforcement-learning",
    "po2025-long-context-state-space",
    "feng2025-learning-interactive-world-model",
    "duan2024-learning-world-models-unconstrained",
    "huang2025-otter-vision-language-action",
    "chen2025-moto-latent-motion-token",
    "ding2024-quar-vla-vision-language",
    "shi2025-hi-robot-open-ended",
    "hou2025-dita-scaling-diffusion-transformer",
    "wu2025-momanipvla-transferring-vision-language",
    "zhang2024-prelar-world-model-pre",
    "zhang2025-up-vla-unified-understanding",
    "li2025-reinforcement-learning-action-chunking",
    "liu2024-robomamba-efficient-vision-language"
  ],
  "counts": {
    "full_papers": 40,
    "by_domain": {
      "embodied_ai": 10,
      "reinforcement_learning": 10,
      "vision_language_action": 10,
      "world_models": 10
    },
    "by_venue": {
      "CVPR": 7,
      "ECCV": 6,
      "ICCV": 8,
      "ICML": 11,
      "NeurIPS": 8
    },
    "by_year": {
      "2023": 4,
      "2024": 10,
      "2025": 26
    },
    "document_level_moves": {
      "ablation_study": 21,
      "as_shown_in_display": 17,
      "baseline_description": 33,
      "comparison_statement": 22,
      "evaluation_statement": 26,
      "implementation_details": 24,
      "metric_description": 20,
      "results_support_statement": 19,
      "table_reports_statement": 10,
      "we_observe_statement": 16
    }
  },
  "observations": [
    "Section headings vary substantially, so protocols should specify functional moves rather than enforce one heading sequence.",
    "Baseline, implementation, evaluation, ablation, and display-referencing moves recur, but their presence alone does not establish comparison fairness or reproducibility.",
    "Result paragraphs commonly point to a display before stating an observation; the library therefore requires a quantified comparison and a calibrated interpretation after that pointer.",
    "Abstract and Introduction claims must be checked against experiment scope instead of being optimized independently for persuasive force."
  ],
  "limitations": [
    "This is a calibration sample, not a statistical estimate of venue style or acceptance determinants.",
    "ICLR papers remain represented in the 300-paper metadata and abstract study but were not included in this full-text sample because the official PDF endpoint rejected automated retrieval during the audit.",
    "Document-level phrase detection can miss wording because PDF text extraction is imperfect and cannot assess scientific validity.",
    "No extracted paper text is redistributed, and all reusable templates are independently authored."
  ]
}
