{
  "id": "section-writing-2026-08",
  "as_of": "2026-08-11",
  "method": "A deterministic, balanced sample of official full-paper PDFs was converted to local text with pdftotext for document-level structural analysis. Ten case-insensitive move detectors (regular expressions over the extracted text) record paper-level presence for ablation, display-pointer, baseline, comparison, evaluation, implementation-detail, metric, results-support, table-reporting, and observation statements. The repository retains only source IDs and aggregate counts, not paper prose.",
  "scope": "Eighty papers from the audited 2021-2025 collection were sampled across reinforcement learning, embodied AI, world models, and vision-language-action models, twenty per domain from CVPR, ECCV, ICCV, ICML, and NeurIPS, to calibrate Abstract, Introduction, Experiments, analysis, and table protocols.",
  "sample_source_ids": [
    "ao2021-co-pilot-collaborative-planning",
    "bastani2022-regret-bounds-risk-sensitive",
    "bjorck2021-low-precision-reinforcement-learning",
    "cetin2021-learning-routines-effective-off",
    "chen2021decisiontransformer",
    "cho2022-s2p-state-conditioned-image",
    "christianos2021-scaling-multi-agent-reinforcement",
    "dadashi2021-offline-reinforcement-learning-pseudometric",
    "ghasemipour2021-emaq-expected-max-q",
    "greenberg2022-efficient-risk-averse-reinforcement",
    "berges2023-galactic-scaling-end-end",
    "bhattasali2022-neural-circuit-architectural-priors",
    "cancelli2023-exploiting-proximity-aware-tasks",
    "chaplot2021-seal-self-supervised-embodied",
    "charlesworth2021-solving-challenging-dexterous-manipulation",
    "chattopadhyay2021-robustnav-benchmarking-robustness-embodied",
    "chebotar2021-actionable-models-unsupervised-offline",
    "chen2021-yourefit-embodied-reference-understanding",
    "chen2022-human-level-bimanual-dexterous",
    "choi2023-efficient-policy-adaptation-contrastive",
    "deng2022-dreamerpro-reconstruction-free-model",
    "guan2023-leveraging-pre-trained-large",
    "huang2024-neural-volumetric-world-models",
    "hutson2024-policy-shaped-prediction-avoiding",
    "koh2021pathdreamer",
    "lin2024-because-bilinear-causal-representation",
    "lu2025-gwm-scalable-gaussian-world",
    "ma2024-do-transformer-world-models",
    "mattes2024-hieros-hierarchical-imagination-structured",
    "novelli2024-operator-world-models-reinforcement",
    "chi2025-impromptu-vla-open-weights",
    "driess2023palme",
    "hong2024-multiply-multisensory-object-centric",
    "jiang2023vima",
    "li2024-decisionnce-embodied-multimodal-representations",
    "li2024-mastering-robot-manipulation-multimodal",
    "li2025-coa-vla-improving-vision",
    "li2025-long-horizon-vision-language",
    "li2025-object-centric-prompt-driven",
    "ma2023-liv-language-image-representations",
    "ganesh2025-sharper-global-convergence-analysis",
    "chen2023-imitation-learning-state-matching",
    "liu2023-learning-identify-critical-states",
    "kong2025-mastering-massive-multi-task",
    "huang2024-diffusion-models-optimizers-efficient",
    "choi2023-local-guided-global-paired",
    "zhai2023-stabilizing-visual-reinforcement-learning",
    "wang2024-more-benefits-being-distributional",
    "barakat2025-global-optimality-policy-gradient",
    "sharma2025-globally-optimal-policy-gradient",
    "dang2025-ecbench-can-multi-modal",
    "kondoh2025-embodied-navigation-auxiliary-task",
    "kim2025-test-time-adaptation-online",
    "cui2024-frontier-enhanced-topological-memory",
    "han2025-roomtour3d-geometry-aware-video",
    "wang2025-rethinking-embodied-gap-vision",
    "li2025-larm-large-auto-regressive",
    "qi2024-shapellm-universal-3d-object",
    "huang2025-enerverse-envisioning-embodied-future",
    "jiang2025-time-reversal-symmetry-efficient",
    "fu2025-knowledge-retention-continual-model",
    "feng2025-gaussian-based-world-model",
    "bar2025-navigation-world-models",
    "lee2025-temporal-distance-aware-transition",
    "hao2025-neural-motion-simulator-pushing",
    "venkatesh2024-understanding-physical-dynamics-counterfactual",
    "hong2024-model-based-reinforcement-learning",
    "po2025-long-context-state-space",
    "feng2025-learning-interactive-world-model",
    "duan2024-learning-world-models-unconstrained",
    "huang2025-otter-vision-language-action",
    "chen2025-moto-latent-motion-token",
    "ding2024-quar-vla-vision-language",
    "shi2025-hi-robot-open-ended",
    "hou2025-dita-scaling-diffusion-transformer",
    "wu2025-momanipvla-transferring-vision-language",
    "zhang2024-prelar-world-model-pre",
    "zhang2025-up-vla-unified-understanding",
    "li2025-reinforcement-learning-action-chunking",
    "liu2024-robomamba-efficient-vision-language"
  ],
  "counts": {
    "full_papers": 80,
    "by_domain": {
      "embodied_ai": 20,
      "reinforcement_learning": 20,
      "vision_language_action": 20,
      "world_models": 20
    },
    "by_venue": {
      "CVPR": 10,
      "ECCV": 7,
      "ICCV": 15,
      "ICML": 26,
      "NeurIPS": 22
    },
    "by_year": {
      "2021": 13,
      "2022": 6,
      "2023": 11,
      "2024": 19,
      "2025": 31
    },
    "document_level_moves": {
      "ablation_study": 44,
      "as_shown_in_display": 41,
      "baseline_description": 72,
      "comparison_statement": 76,
      "evaluation_statement": 51,
      "implementation_details": 31,
      "metric_description": 49,
      "results_support_statement": 47,
      "table_reports_statement": 20,
      "we_observe_statement": 37
    }
  },
  "observations": [
    "Section headings vary substantially, so protocols should specify functional moves rather than enforce one heading sequence.",
    "Baseline, implementation, evaluation, ablation, and display-referencing moves recur, but their presence alone does not establish comparison fairness or reproducibility.",
    "Result paragraphs commonly point to a display before stating an observation; the library therefore requires a quantified comparison and a calibrated interpretation after that pointer.",
    "Abstract and Introduction claims must be checked against experiment scope instead of being optimized independently for persuasive force."
  ],
  "limitations": [
    "This is a calibration sample, not a statistical estimate of venue style or acceptance determinants.",
    "ICLR papers remain represented in the 300-paper metadata and abstract study but were not included in this full-text sample because the official PDF endpoint rejected automated retrieval during the audit.",
    "One ECCV 2022 candidate was deterministically replaced with the next in-domain candidate because its official open-access PDF endpoint does not expose a retrievable file.",
    "Document-level phrase detection can miss wording because PDF text extraction is imperfect and cannot assess scientific validity.",
    "No extracted paper text is redistributed, and all reusable templates are independently authored."
  ]
}
